{
  "semana": "2026-W37",
  "rango": "2026-09-07 / 2026-09-13",
  "generado_utc": "2026-09-05T21:46:26Z",
  "modelo": "claude-opus-5",
  "angulo_semanal": {
    "titular": "Translated everywhere, cited nowhere",
    "tesis": "La visibilidad en las respuestas generadas por IA no es un numero global: hay una por mercado. Una marca puede tener todo su contenido traducido y aun asi no ser citada en la capa de respuestas de sus mercados secundarios, porque esa capa se alimenta de fuentes, competidores y formas de preguntar que son locales. Traducir da cobertura linguistica, no presencia InRegion. Por eso el diagnostico se hace mercado por mercado, no en el idioma de la casa matriz.",
    "pilar_native-reach": "InRegion",
    "publico": "CMOs y heads of global marketing de empresas enterprise que ya operan en varios mercados y sospechan que su contenido localizado no esta apareciendo en las respuestas generadas por IA.",
    "cta": "https://www.acme-multilingual.example/global-visibility-audit/"
  },
  "piezas": [
    {
      "id": "translated-everywhere-cited-nowhere",
      "canal": "blog",
      "fecha": "2026-09-08",
      "titulo": "Translated Everywhere, Cited Nowhere: AI Discoverability Is a Per-Market Number",
      "cuerpo": "Every page is translated. Every market is live. Then a regional lead forwards you a screenshot: a buying question asked in her language, an AI-generated answer that lists a handful of vendors, and none of them is you.\n\nThe reflex is to file that as a coverage gap and send it back to the localization queue. It is not a coverage gap. Coverage arrived. Something else did not.\n\n## One number, reported in the wrong language\n\nWe have already said that \"AI-generated answers are changing how visibility works,\" and that measuring it is the hard part. What that left open is the unit. Most teams still ask \"what is our AI visibility?\" as if it were a single figure, calculated in the language of headquarters.\n\nIt is not a single figure. There is one per market.\n\nTranslation moves your words across a language boundary. It does not move your brand into the set of sources a model reaches for when a buyer in Sao Paulo or Munich asks a question in their own words. Those are different systems, fed by different inputs.\n\n## What makes the answer layer local\n\nThe inputs that shape an answer in a given market have almost nothing to do with language.\n\n**Local sources.** The publications, comparison sites, and industry bodies a model leans on in Brazil are not the ones it leans on in the US. English-language coverage does not travel.\n\n**Local competitors.** The vendors that appear in a German answer are the ones with German-market presence. They may not be the ones on your global battlecard.\n\n**The local shape of the question.** Buyers do not ask a translated version of your English query. They ask a different question, assembled from local categories and local buying habits.\n\nThat is the InRegion pillar of Native Reach, stated plainly: campaigns \"should match local demand, local rivals, and local buyer needs.\" Local trends, local competitors, local needs. It describes the problem word for word.\n\n## Ranking is not citation\n\nAcme's published results include an 63% increase in conversions in Brazil through SEO. That is a real result, in one market and in the results-list layer. It is also the limit of what a ranking number can tell you: it measures whether you can be found in a list. It says nothing about whether you are cited in an answer. [DATO FALTANTE: share of traffic coming from AI-generated answers, by market - not published]\n\nSo the diagnosis has to change shape. Asked once per market, separately: which sources are shaping the answers here? Which competitors appear in them, and on the strength of what? How do buyers here actually phrase the question? Is our content in a form that can be cited, or only in a form that can be read?\n\n## Where to start\n\nEarlier this month we announced a partnership with Searchline, connecting \"Searchline's AI search intelligence with Acme's global content expertise.\" That announcement described a capability. This is the problem the capability exists for. [DATO FALTANTE: partnership outcome metrics - the announcement publishes no figures]\n\nTake one market: the one where the numbers look good and the pipeline does not. Start with the Free Global Visibility Audit.",
      "cta": "Free Global Visibility Audit - https://www.acme-multilingual.example/global-visibility-audit/",
      "keywords": [
        "ai discoverability by market",
        "ai visibility per market",
        "cited in ai answers",
        "multilingual ai discoverability",
        "answer layer by market"
      ],
      "fuentes": [
        "activos/sitio-native-reach.md",
        "activos/sitio-home.md",
        "activos/blog-indice.md",
        "activos/calendario.csv"
      ]
    },
    {
      "id": "news-w37-one-number-one-market",
      "canal": "newsletter",
      "fecha": "2026-09-10",
      "titulo": "Your AI visibility number describes one market",
      "cuerpo": "Everything is translated. Every market is live. And in the answers your buyers are reading, in their own language, you are not there.\n\nAsk your team for \"our AI visibility\" and a number comes back. That number describes your home market. It does not describe the others.\n\nEach market assembles its own answer layer: out of the sources buyers there read, the competitors buyers there already know, and the way a question gets phrased when nobody translates it first. Translation clears the language barrier. It does not put you in that set.\n\nThe uncomfortable part is where this shows up. The markets most likely to be missing are the ones whose dashboards look healthy. Acme's published results include an 63% increase in conversions in Brazil through SEO - a result in one market, in the results-list layer. Whether that market's AI-generated answers cite you is a different question and has to be measured separately. [DATO FALTANTE: share of traffic coming from AI-generated answers, by market - not published]\n\nThe InRegion pillar of Native Reach says campaigns \"should match local demand, local rivals, and local buyer needs.\" Nothing in that sentence is about language. That is the whole point.\n\n## Before your next quarterly review\n\nPick your largest market outside your home market. For that market alone, ask which sources are shaping the answers buyers see, which competitors show up in them, and how those buyers actually phrase the question. Then do the next market.\n\nWhat you are looking for is not one score. It is the gap between markets.\n\nWe announced a partnership with Searchline this month to work on exactly this layer, connecting \"Searchline's AI search intelligence with Acme's global content expertise.\" The capability is the easy half. Knowing which market to point it at is the half worth your morning.\n\nStart here: Free Global Visibility Audit - https://www.acme-multilingual.example/global-visibility-audit/",
      "cta": "Free Global Visibility Audit - https://www.acme-multilingual.example/global-visibility-audit/",
      "keywords": [
        "ai visibility by market",
        "ai discoverability audit",
        "market by market discoverability"
      ],
      "fuentes": [
        "activos/sitio-native-reach.md",
        "activos/sitio-home.md",
        "activos/blog-indice.md",
        "activos/calendario.csv"
      ]
    },
    {
      "id": "li-01",
      "canal": "linkedin",
      "fecha": "2026-09-08",
      "titulo": "Your content is translated everywhere and cited nowhere.",
      "cuerpo": "You have a page in every language you sell in. Then a buyer in one of those markets asks the AI answer layer a purchase question, and the answer comes back assembled from local sources, local competitors, and the local phrasing of that question. Your translated page was never part of it.\n\nCoverage in a language is not presence in a market. InRegion says it plainly: \"Campaigns should match local demand, local rivals, and local buyer needs.\"\n\nOne global visibility score hides the market where you are absent. Read it market by market instead.",
      "cta": "Free Global Visibility Audit - https://www.acme-multilingual.example/global-visibility-audit/",
      "keywords": [],
      "fuentes": [
        "activos/sitio-native-reach.md",
        "activos/sitio-home.md",
        "activos/blog-indice.md"
      ]
    },
    {
      "id": "x-01",
      "canal": "x",
      "fecha": "2026-09-09",
      "titulo": "Translated everywhere, cited nowhere.",
      "cuerpo": "In each of your markets the AI answer layer builds from local sources, local competitors, and the local phrasing of the question. One global visibility number hides that.",
      "cta": "https://www.acme-multilingual.example/global-visibility-audit/",
      "keywords": [],
      "fuentes": [
        "activos/sitio-native-reach.md",
        "activos/sitio-home.md",
        "activos/blog-indice.md"
      ]
    },
    {
      "id": "li-02",
      "canal": "linkedin",
      "fecha": "2026-09-10",
      "titulo": "\"Are we visible in AI answers?\" is the wrong question.",
      "cuerpo": "The right one is: in which markets are we not, and who is being cited instead of us?\n\nThe answer layer is assembled locally. Different sources carry weight, different competitors get named, and the same buying question is phrased differently in each market. A single global read averages that into a number describing no market you actually sell in.\n\nInRegion is the pillar that fails here, and it fails one market at a time. So the read has to be per market: which questions, which local sources, which competitor gets named in your place.",
      "cta": "Free Global Visibility Audit - https://www.acme-multilingual.example/global-visibility-audit/ #NativeReach",
      "keywords": [],
      "fuentes": [
        "activos/sitio-native-reach.md",